{
  "medf": {
    "version": "1.0",
    "schema": "https://medf.org/schema/v1.0"
  },
  "metadata": {
    "id": "ai-dialogue-example-001",
    "title": "AI対話記録：MeDFフォーマット設計セッション",
    "type": "analysis",
    "status": "official",
    "created": "2026-02-03T15:30:00Z",
    "modified": "2026-02-03T16:45:00Z",
    "version": "1.0.0",
    "authors": [
      {
        "name": "Development Team",
        "role": "creator"
      },
      {
        "name": "AI Assistant",
        "role": "contributor"
      }
    ],
    "tags": ["AI対話", "設計", "MeDF"],
    "language": "ja",
    "security": {
      "classification": "internal"
    }
  },
  "index": {
    "toc": [
      {
        "id": "context",
        "title": "対話コンテキスト",
        "level": 1,
        "summary": "対話の背景と目的"
      },
      {
        "id": "dialogue",
        "title": "対話内容",
        "level": 1,
        "summary": "質問と回答のログ",
        "children": [
          {
            "id": "q1",
            "title": "Q1: フォーマットの選択",
            "level": 2
          },
          {
            "id": "q2",
            "title": "Q2: インデックス構造",
            "level": 2
          },
          {
            "id": "q3",
            "title": "Q3: AIとの親和性",
            "level": 2
          }
        ]
      },
      {
        "id": "conclusions",
        "title": "結論と次のステップ",
        "level": 1,
        "summary": "対話から得られた知見と行動項目"
      }
    ],
    "keywords": [
      {
        "term": "JSON",
        "frequency": 8,
        "contexts": ["q1", "conclusions"]
      },
      {
        "term": "機械可読性",
        "frequency": 5,
        "contexts": ["q3", "conclusions"]
      }
    ]
  },
  "content": {
    "sections": [
      {
        "id": "context",
        "title": "対話コンテキスト",
        "type": "text",
        "body": "このセッションでは、MeDFフォーマットの技術的な設計判断について、AIアシスタントと議論を行いました。主な目的は、フォーマット選択の妥当性検証と、AIによる処理のしやすさの確認です。",
        "metadata": {
          "importance": "medium",
          "confidence": 1.0
        }
      },
      {
        "id": "dialogue",
        "title": "対話内容",
        "type": "text",
        "body": "以下、実際の対話ログ"
      },
      {
        "id": "q1",
        "title": "Q1: フォーマットの選択",
        "type": "data",
        "body": {
          "question": {
            "speaker": "Human",
            "timestamp": "2026-02-03T15:35:00Z",
            "text": "MeDFのベースフォーマットとして、JSON、XML、YAMLのどれが最適でしょうか？それぞれの長所と短所を教えてください。"
          },
          "answer": {
            "speaker": "AI",
            "timestamp": "2026-02-03T15:36:30Z",
            "text": "各フォーマットの比較：\n\n**JSON**\n長所：\n- 広く普及、ほぼ全ての言語でサポート\n- パース速度が速い\n- 構造が明確で、スキーマ検証（JSON Schema）が確立\n- ファイルサイズが比較的小さい\n\n短所：\n- コメントが書けない（仕様上）\n- 末尾カンマなどの制約がやや厳しい\n\n**XML**\n長所：\n- スキーマ検証が強力（XSD）\n- 名前空間による拡張性\n- コメント可能\n\n短所：\n- 冗長でファイルサイズが大きい\n- パースが重い\n- 可読性が低い\n\n**YAML**\n長所：\n- 人間に読みやすい\n- コメント可能\n- 記述量が少ない\n\n短所：\n- パーサーの品質にばらつき\n- インデントによる構造定義が厳密でエラーが起きやすい\n- セキュリティ上の懸念（任意コード実行の可能性）\n\n**推奨：JSON**\n理由：機械可読性と汎用性のバランスが最良。AI処理に最適。"
          },
          "decision": "JSONを採用"
        }
      },
      {
        "id": "q2",
        "title": "Q2: インデックス構造",
        "type": "data",
        "body": {
          "question": {
            "speaker": "Human",
            "timestamp": "2026-02-03T15:40:00Z",
            "text": "インデックスセクションに含めるべき情報は何ですか？"
          },
          "answer": {
            "speaker": "AI",
            "timestamp": "2026-02-03T15:42:00Z",
            "text": "AIと人間の両方が効率的にナビゲートできるよう、以下の多次元インデックスを推奨します：\n\n1. **目次（TOC）**：階層構造を持つセクション一覧\n2. **キーワード**：重要用語とその出現箇所\n3. **エンティティ**：人名、組織名、技術名などの固有名詞\n4. **関係性**：セクション間の参照・依存関係\n\nこれにより、AIは文脈を理解しやすくなり、人間は必要な情報に素早くアクセスできます。"
          },
          "decision": "4種類のインデックスを実装"
        }
      },
      {
        "id": "q3",
        "title": "Q3: AIとの親和性",
        "type": "data",
        "body": {
          "question": {
            "speaker": "Human",
            "timestamp": "2026-02-03T15:50:00Z",
            "text": "このフォーマットは、AIによる自動要約や質問応答に適していますか？"
          },
          "answer": {
            "speaker": "AI",
            "timestamp": "2026-02-03T15:52:00Z",
            "text": "はい、非常に適しています。理由：\n\n1. **構造化データ**：セクション単位で処理可能\n2. **メタデータ**：重要度、信頼度などの付加情報が処理の優先順位付けに役立つ\n3. **インデックス**：全体像の把握が容易\n4. **参照情報**：外部ソースへのトレーサビリティ\n5. **アノテーション**：人間の注釈がコンテキスト理解を補助\n\nEmbedding生成、RAG（Retrieval-Augmented Generation）、自動要約、すべてに最適化されています。"
          },
          "decision": "AI処理を前提とした設計を継続"
        }
      },
      {
        "id": "conclusions",
        "title": "結論と次のステップ",
        "type": "text",
        "body": "本セッションの主な結論：\n\n1. **JSONを基本フォーマットとして採用** - 汎用性と機械可読性のバランスが最良\n2. **4種類の多次元インデックス** - AIと人間の両方が効率的にナビゲート可能\n3. **AI処理に最適化** - Embedding、RAG、要約などの用途に適している\n\n次のステップ：\n- JSON Schemaの詳細設計\n- バリデーターの実装\n- サンプルドキュメントの作成",
        "metadata": {
          "importance": "high",
          "confidence": 1.0
        },
        "annotations": [
          {
            "type": "todo",
            "text": "次回レビューミーティングで承認を得る",
            "timestamp": "2026-02-03T16:45:00Z"
          }
        ]
      }
    ]
  },
  "references": {
    "external": [
      {
        "id": "ref-json-spec",
        "type": "website",
        "title": "The JSON Data Interchange Format",
        "url": "https://www.json.org/",
        "accessed": "2026-02-03T15:30:00Z",
        "status": "active"
      }
    ]
  }
}
